rank,ticker,company,asset_type,liquidity_signal,why_good_for_options,bucket,primary_source,source_url,source_as_of
1,TSLA,Tesla,Stock,"2,526,080 options volume on TipRanks most-active list (Apr 7, 2026)",One of the deepest retail/institutional options markets; frequent catalysts and tight chains across many expiries,Core high-liquidity momentum name,TipRanks most active options snapshot + Barchart April 2026 best options stocks,https://www.tipranks.com/options/most-active-stocks-options | https://www.barchart.com/story/news/950484/5-best-stocks-for-options-trading-in-april-2026,2026-04-07 / 2026-03-25
2,NVDA,NVIDIA,Stock,"1,393,755 options volume on TipRanks most-active list; highlighted by Barchart as a top April 2026 options stock",Extremely liquid AI bellwether with frequent event risk and expanded short-dated expiries,Core high-liquidity momentum name,TipRanks most active options snapshot + Barchart April 2026 best options stocks,https://www.tipranks.com/options/most-active-stocks-options | https://www.barchart.com/story/news/950484/5-best-stocks-for-options-trading-in-april-2026,2026-04-07 / 2026-03-25
3,AAPL,Apple,Stock,"1,189,757 options volume on TipRanks most-active list (Apr 7, 2026)","Usually offers very deep chains, many strikes, and relatively efficient pricing for directional or income strategies",Core mega-cap liquidity name,TipRanks most active options snapshot,https://www.tipranks.com/options/most-active-stocks-options,2026-04-07
4,AMZN,Amazon,Stock,"391,358 options volume on TipRanks most-active list; highlighted by Barchart as a top April 2026 options stock",High institutional participation and earnings/news sensitivity make it attractive for spreads and directional trades,Core mega-cap liquidity name,TipRanks most active options snapshot + Barchart April 2026 best options stocks,https://www.tipranks.com/options/most-active-stocks-options | https://www.barchart.com/story/news/950484/5-best-stocks-for-options-trading-in-april-2026,2026-04-07 / 2026-03-25
5,AVGO,Broadcom,Stock,"367,555 options volume on TipRanks most-active list (Apr 7, 2026)",Semiconductor name with steady institutional flow and strong event sensitivity,Semiconductor / earnings-driven name,TipRanks most active options snapshot,https://www.tipranks.com/options/most-active-stocks-options,2026-04-07
6,AMD,Advanced Micro Devices,Stock,"316,510 options volume on TipRanks most-active list (Apr 7, 2026)","Active retail/institutional flow, good weekly liquidity, strong semiconductor beta",Semiconductor / tactical trading name,TipRanks most active options snapshot,https://www.tipranks.com/options/most-active-stocks-options,2026-04-07
7,MSFT,Microsoft,Stock,"309,706 options volume on TipRanks most-active list; highlighted by Barchart as a top April 2026 options stock",Mega-cap with reliable liquidity and clean event calendars; often useful for lower-volatility large-cap option structures,Core mega-cap quality name,TipRanks most active options snapshot + Barchart April 2026 best options stocks,https://www.tipranks.com/options/most-active-stocks-options | https://www.barchart.com/story/news/950484/5-best-stocks-for-options-trading-in-april-2026,2026-04-07 / 2026-03-25
8,META,Meta Platforms,Stock,"291,508 options volume on TipRanks most-active list; highlighted by Barchart as a top April 2026 options stock",Heavy liquidity plus sharp reaction to ad/AI/capex headlines can support premium and directional setups,Core mega-cap momentum name,TipRanks most active options snapshot + Barchart April 2026 best options stocks,https://www.tipranks.com/options/most-active-stocks-options | https://www.barchart.com/story/news/950484/5-best-stocks-for-options-trading-in-april-2026,2026-04-07 / 2026-03-25
9,GOOGL,Alphabet,Stock,"292,033 options volume on TipRanks most-active list (Apr 7, 2026)","Very liquid large-cap tech chain suitable for directional, earnings, and defined-risk spread trading",Core mega-cap liquidity name,TipRanks most active options snapshot,https://www.tipranks.com/options/most-active-stocks-options,2026-04-07
10,PLTR,Palantir,Stock,"263,671 options volume on TipRanks most-active list (Apr 7, 2026)",Very active retail interest and higher implied volatility can create opportunity for premium sellers and tactical traders,Higher-volatility tactical name,TipRanks most active options snapshot,https://www.tipranks.com/options/most-active-stocks-options,2026-04-07
11,MSTR,MicroStrategy,Stock,"254,879 options volume on TipRanks most-active list (Apr 7, 2026)","Crypto-linked volatility produces large option premiums, though risk is much higher than mega-cap tech",High-volatility specialist name,TipRanks most active options snapshot,https://www.tipranks.com/options/most-active-stocks-options,2026-04-07
12,INTC,Intel,Stock,"602,132 options volume on TipRanks most-active list (Apr 7, 2026)","Large, liquid chain with broad retail participation and frequent semiconductor headline risk",Value/turnaround semiconductor name,TipRanks most active options snapshot,https://www.tipranks.com/options/most-active-stocks-options,2026-04-07
13,MU,Micron,Stock,"380,464 options volume on TipRanks most-active list (Apr 7, 2026)",Memory cycle sensitivity tends to create tradable swings and active weekly options,Semiconductor / cycle-sensitive name,TipRanks most active options snapshot,https://www.tipranks.com/options/most-active-stocks-options,2026-04-07
14,NFLX,Netflix,Stock,"185,300 options volume on TipRanks most-active list (Apr 7, 2026)",A classic earnings and subscriber-growth event name with active short-dated flow,Event-driven large-cap name,TipRanks most active options snapshot,https://www.tipranks.com/options/most-active-stocks-options,2026-04-07
15,BAC,Bank of America,Stock,"141,605 options volume on TipRanks most-active list (Apr 7, 2026)","Financial sector staple with liquid weeklys, useful for lower-priced directional or income option structures",Financial liquidity name,TipRanks most active options snapshot,https://www.tipranks.com/options/most-active-stocks-options,2026-04-07
